{"commands":[{"argv":["cargo","fmt","--all","--","--check"],"exit_code":0,"status":"passed","termination":"completed"},{"argv":["python3","tools/sync_docs_assets.py","--check"],"exit_code":0,"status":"passed","termination":"completed"},{"argv":["python3","tools/verify_docs.py"],"exit_code":0,"status":"passed","termination":"completed"},{"argv":["python3","tools/verify_test_layout.py","--check"],"exit_code":0,"status":"passed","termination":"completed"},{"argv":["cargo","check","--workspace","--all-targets","--locked"],"exit_code":0,"status":"passed","termination":"completed"},{"argv":["cargo","clippy","--workspace","--all-targets","--locked","--","-D","warnings"],"exit_code":0,"status":"passed","termination":"completed"},{"argv":["cargo","deny","check"],"exit_code":0,"status":"passed","termination":"completed"},{"argv":["python3","tools/verify_quality_contracts.py"],"exit_code":0,"status":"passed","termination":"completed"},{"argv":["cargo","test","--workspace","--test","arch_*","--locked"],"exit_code":0,"status":"passed","termination":"completed"},{"argv":["cargo","test","--workspace","--lib","--bins","--locked"],"exit_code":0,"status":"passed","termination":"completed"},{"argv":["cargo","test","--workspace","--doc","--locked"],"exit_code":0,"status":"passed","termination":"completed"},{"argv":["cargo","test","--workspace","--test","int_*","--locked"],"exit_code":0,"status":"passed","termination":"completed"},{"argv":["python3","tools/run_fuzzing.py"],"exit_code":0,"status":"passed","termination":"completed"},{"argv":["python3","tools/run_e2e.py"],"exit_code":0,"status":"passed","termination":"completed"},{"argv":["python3","tools/verify_contracts.py","--all"],"exit_code":0,"status":"passed","termination":"completed"},{"argv":["python3","tools/verify_verification_runner.py"],"exit_code":0,"status":"passed","termination":"completed"}],"product_version":"0.1.0","report":{"schema_version":"podway.phase0.verification-report/v4","self_digest":"7bd2e890f30be594dd222b87c775ddd90523aba31926f6ddf473b5223e0fe5eb","sha256":"f620441a25fc48776b893f6eb7413b2815851a77ba7e748fcd4ed2493b5b2b5c"},"schema_version":"podway.phase0.verification-attestation/v1","source_manifest":{"file_count":270,"sha256":"fccb6d0b5874126f2433bcf42c057b970523cb8a36d5fe4739b39123d8a22031"},"status":"passed"}